{
  "status": "success",
  "command": "explain.project",
  "data": {
    "subject": {
      "id": "prj_mobile_redesign_2025",
      "type": "project",
      "title": "Mobile App UI Redesign",
      "description": "Complete overhaul of mobile application user interface to improve user experience and align with modern design standards",
      "metadata": {
        "created_at": "2024-12-01T10:00:00Z",
        "updated_at": "2025-01-15T11:45:00Z",
        "priority": "high",
        "status": "planning"
      }
    },
    "reasoning": {
      "total_steps": 6,
      "steps": [
        {
          "step_number": 1,
          "description": "Assessed strategic alignment with company OKRs",
          "rationale": "Projects must support key business objectives to justify resource allocation",
          "input_data": {
            "company_okrs_q1_2025": [
              "Increase user engagement by 25%",
              "Improve mobile conversion rate to 8%",
              "Launch 2 major product features"
            ],
            "project_contributions": {
              "user_engagement": 0.85,
              "conversion_rate": 0.92,
              "feature_delivery": 0.15
            }
          },
          "output_result": {
            "okr_alignment_score": 0.89,
            "strategic_importance": "critical",
            "business_impact_potential": "high"
          },
          "confidence": 0.93,
          "execution_time_ms": 180
        },
        {
          "step_number": 2,
          "description": "Calculated resource availability and team capacity",
          "rationale": "Project feasibility depends on having adequate skilled resources",
          "input_data": {
            "required_skills": ["UI/UX Design", "React Native", "iOS", "Android", "QA Testing"],
            "team_capacity": {
              "designers": 2,
              "mobile_developers": 3,
              "qa_engineers": 1
            },
            "utilization_rates": {
              "designers": 0.75,
              "mobile_developers": 0.68,
              "qa_engineers": 0.90
            },
            "estimated_effort_weeks": 16
          },
          "output_result": {
            "resource_feasibility": 0.72,
            "capacity_utilization": 0.78,
            "timeline_risk": "medium"
          },
          "confidence": 0.86,
          "execution_time_ms": 95
        },
        {
          "step_number": 3,
          "description": "Analyzed competitive positioning and market timing",
          "rationale": "Market conditions and competitive landscape affect project priority",
          "input_data": {
            "competitor_analysis": {
              "recent_ui_updates": 3,
              "user_satisfaction_gap": 0.23,
              "market_trend_alignment": 0.87
            },
            "user_feedback_themes": [
              "outdated interface",
              "poor navigation",
              "inconsistent design",
              "accessibility issues"
            ]
          },
          "output_result": {
            "market_timing_score": 0.91,
            "competitive_urgency": 0.78,
            "user_demand_strength": 0.85
          },
          "confidence": 0.81,
          "execution_time_ms": 125
        },
        {
          "step_number": 4,
          "description": "Evaluated technical dependencies and risks",
          "rationale": "Technical complexity and dependencies affect project success probability",
          "input_data": {
            "technical_dependencies": [
              "API v2.1 completion",
              "Design system v3.0",
              "A/B testing framework"
            ],
            "dependency_readiness": [0.95, 0.60, 0.88],
            "technical_risk_factors": [
              "Cross-platform compatibility",
              "Performance optimization",
              "Legacy code migration"
            ]
          },
          "output_result": {
            "technical_feasibility": 0.76,
            "dependency_risk": 0.35,
            "implementation_complexity": "high"
          },
          "confidence": 0.79,
          "execution_time_ms": 110
        },
        {
          "step_number": 5,
          "description": "Calculated ROI and business value metrics",
          "rationale": "Investment decisions require clear understanding of expected returns",
          "input_data": {
            "investment_estimate": 280000,
            "projected_benefits": {
              "user_retention_improvement": 0.15,
              "conversion_rate_lift": 0.12,
              "support_cost_reduction": 0.08
            },
            "benefit_monetization": {
              "retention_value": 420000,
              "conversion_value": 180000,
              "cost_savings": 45000
            }
          },
          "output_result": {
            "roi_estimate": 1.85,
            "payback_period_months": 8.5,
            "risk_adjusted_roi": 1.62
          },
          "confidence": 0.74,
          "execution_time_ms": 85
        },
        {
          "step_number": 6,
          "description": "Applied weighted scoring model for final prioritization",
          "rationale": "Combine multiple factors with appropriate weights for comprehensive evaluation",
          "input_data": {
            "scoring_weights": {
              "strategic_alignment": 0.30,
              "resource_feasibility": 0.20,
              "market_timing": 0.20,
              "technical_feasibility": 0.15,
              "roi_potential": 0.15
            },
            "normalized_scores": {
              "strategic_alignment": 0.89,
              "resource_feasibility": 0.72,
              "market_timing": 0.91,
              "technical_feasibility": 0.76,
              "roi_potential": 0.82
            }
          },
          "output_result": {
            "weighted_score": 8.15,
            "percentile_rank": 0.88,
            "priority_tier": "high"
          },
          "confidence": 0.87,
          "execution_time_ms": 45
        }
      ],
      "primary_logic": "Multi-criteria project evaluation with strategic alignment emphasis",
      "fallback_logic": "ROI-based ranking with resource constraint consideration"
    },
    "factors": {
      "total_score": 8.15,
      "normalization_method": "weighted_average",
      "factors": [
        {
          "id": "strategic_alignment",
          "name": "Strategic Business Alignment",
          "category": "framework",
          "raw_score": 0.89,
          "weight": 0.30,
          "weighted_contribution": 0.267,
          "confidence": 0.93,
          "theory_basis": {
            "framework": "OKR",
            "reference": "Objectives and Key Results methodology",
            "concept": "Strategic goal cascade and alignment measurement"
          },
          "evidence": [
            {
              "type": "data_point",
              "description": "Direct contribution to Q1 user engagement OKR",
              "value": 0.85,
              "weight": 0.4,
              "source": "okr_impact_analysis"
            },
            {
              "type": "data_point",
              "description": "High impact on mobile conversion rate OKR",
              "value": 0.92,
              "weight": 0.4,
              "source": "conversion_modeling"
            },
            {
              "type": "pattern",
              "description": "UI improvements historically drive engagement",
              "value": 0.78,
              "weight": 0.2,
              "source": "historical_project_analysis"
            }
          ],
          "calculation_method": "Weighted OKR contribution scoring with historical validation"
        },
        {
          "id": "market_timing",
          "name": "Market Timing & Competitive Position",
          "category": "context",
          "raw_score": 0.91,
          "weight": 0.20,
          "weighted_contribution": 0.182,
          "confidence": 0.81,
          "evidence": [
            {
              "type": "data_point",
              "description": "3 major competitors updated UIs in last 6 months",
              "value": 3,
              "weight": 0.3,
              "source": "competitive_intelligence"
            },
            {
              "type": "pattern",
              "description": "Strong user demand signals from feedback and surveys",
              "value": 0.85,
              "weight": 0.4,
              "source": "user_research_analysis"
            },
            {
              "type": "heuristic",
              "description": "Market trend strongly favors modern, accessible design",
              "value": 0.87,
              "weight": 0.3,
              "source": "market_trend_analysis"
            }
          ],
          "calculation_method": "Competitive urgency and user demand aggregation"
        },
        {
          "id": "roi_potential",
          "name": "Return on Investment Potential",
          "category": "framework",
          "raw_score": 0.82,
          "weight": 0.15,
          "weighted_contribution": 0.123,
          "confidence": 0.74,
          "theory_basis": {
            "framework": "Custom",
            "reference": "Financial evaluation methodology",
            "concept": "Risk-adjusted ROI calculation for product investments"
          },
          "evidence": [
            {
              "type": "data_point",
              "description": "Projected ROI of 1.85x over 24 months",
              "value": 1.85,
              "weight": 0.5,
              "source": "financial_modeling"
            },
            {
              "type": "data_point",
              "description": "Payback period under 9 months",
              "value": 8.5,
              "weight": 0.3,
              "source": "cash_flow_analysis"
            },
            {
              "type": "heuristic",
              "description": "UI projects typically deliver 15-25% engagement lift",
              "value": 0.20,